<?xml version="1.0" encoding="UTF-8" ?>

<!--
  ~ Copyright (C) 2016  Florian Warzecha <flowa2000@gmail.com>
  ~
  ~ This file is part of infoDisplay.
  ~
  ~ infoDisplay is free software: you can redistribute it and/or modify
  ~ it under the terms of the GNU General Public License as published by
  ~ the Free Software Foundation, either version 3 of the License, or
  ~ (at your option) any later version.
  ~
  ~ infoDisplay is distributed in the hope that it will be useful,
  ~ but WITHOUT ANY WARRANTY; without even the implied warranty of
  ~ MERCHANTABILITY or FITNESS FOR A PARTICULAR PURPOSE.  See the
  ~ GNU General Public License for more details.
  ~
  ~ You should have received a copy of the GNU General Public License
  ~ along with this program.  If not, see <http://www.gnu.org/licenses/>.
  ~
  ~ infoDisplay uses TelegramBots Java API <https://github.com/rubenlagus/TelegramBots> by Ruben Bermudez.
  ~ TelegramBots API is licensed under GNU General Public License version 3 <https://www.gnu.org/licenses/gpl-3.0.de.html>.
  ~
  ~ infoDisplay uses parts of the Apache Commons project <https://commons.apache.org/>.
  ~ Apache commons is licensed under the Apache License Version 2.0 <http://www.apache.org/licenses/>.
  ~
  ~ infoDisplay uses vlcj library <http://capricasoftware.co.uk/#/projects/vlcj>.
  ~ vlcj is licensed under GNU General Public License version 3 <https://www.gnu.org/licenses/gpl-3.0.de.html>.
  ~
  ~ Thanks to all the people who contributed to the projects that make this
  ~ program possible.
  -->

<!-- Please use '/n>' to produce a newline character in output-->

<language xmlns:xsi="http://www.w3.org/2001/XMLSchema-instance" xsi:noNamespaceSchemaLocation="language.xsd">
    <name>en</name>
    <command_message command="start_command">
        <case case="userUnknown">
            <part position="1">Hello</part>
            <part position="2">,/n>as you know this bot, you probably already know how to use it, although you can use
                the '/help' command. If you do not know it yet, it probably will not be useful for you. If you have a
                question concerning this bot, feel free to ask it via '/ask'.</part>
        </case>
        <case case="userKnown">
            <part position="1">Hello</part>
            <part position="2">,/n>nice to see you again. I hope you still know all the commands, if not
                the '/help' command will always be you guide.</part>
        </case>
    </command_message>
    <command_message command="stop_command">
        <part position="1">Bye</part>
        <part position="2">./n>It was nice to work with you.</part>
    </command_message>
    <command_message command="send_on_error_occurred_command">
        <case case="terminating">
            <part position="1">The bot was terminated because of an internal error. Please advise the administrator of
                this event.</part>
        </case>
        <case case="not_terminating">
            <part position="1">An internal error occurred while processing your request. Please contact the
                administrator.</part>
        </case>
    </command_message>
    <command_message command="register_command">
        <case case="alreadyRegistered">
            <part position="1">You are already registered. Your telegram userID is: </part>
        </case>
        <case case="registrationRequestSent">
            <part position="1">You have already sent a registration request. Your telegram userID is:</part>
        </case>
        <case case="newRegistrationRequest">
            <part position="1">The administrator will be advised that you want to be registered. That why he will get in
                contact with you soon. Your telegram userID is: </part>
        </case>
        <case case="toAdmin">
            <part position="1">The user </part>
            <part position="2">wants to get registered. His userID is: </part>
        </case>
    </command_message>
    <command_message command="id_command">
        <part position="1">Your telegram userID is:</part>
        <part position="2">The chatID is:</part>
    </command_message>
    <command_message command="help_command">
        <part position="1">*Help*/n>/n>
            _Description_/n>
            Mit diesem Bot kannst Du Bilder an das virtuelle Brett hochladen, bearbeiten und wieder löschen. Als
            Administrator kannst du auch veraltete Bilder *anderer* löschen und deren Eigenschaften bearbeiten./n>/n>
            _How to use me:_/n>
        </part>
    </command_message>
    <command_message command="administrator_command">
        <part position="1">Ersteller / Administrator dieses Bots ist @liketechnik2000.</part>
    </command_message>
</language>